pub_date	title	venue	excerpt	citation	url_slug	paper_url
2020-01-01	Linking mineralogy and spectroscopy of highly aqueously altered CM and CI carbonaceous chondrites in preparation for primitive asteroid sample return	Meteoritics and Planetary Science		<b>Bates, H. C.,</b> King, A. J., Donaldson Hanna K. L., Bowles, N. E., and Russell, S. S.  (2020). Linking mineralogy and spectroscopy of highly aqueously altered CM and CI carbonaceous chondrites in preparation for primitive asteroid sample return, <i>Meteoritics and Planetary Science</i>. 55:77-101.	BatesCM1	http://hellybates.github.io/files/Bates2020.pdf
2021-05-28	A Spectral Investigation of Aqueously and Thermally Altered CM, CM-An, and CY Chondrites Under Simulated Asteroid Conditions for Comparison With OSIRIS-REx and Hayabusa2 Observations	Journal of Geophysical Research: Planets		<b>Bates, H. C.,</b> Donaldson Hanna K. L., King, A. J.,  Bowles, N. E., and Russell, S. S. (2021). A Spectral Investigation of Aqueously and Thermally Altered CM, CM-An, and CY Chondrites Under Simulated Asteroid Conditions for Comparison With OSIRIS-REx and Hayabusa2 Observations <i>Journal of Geophysical Research: Planets</i>. 126(7).	BatesSpec	http://hellybates.github.io/files/Bates2021.pdf
2019-12-01	The Yamato-type (CY) carbonaceous chondrite group: Analogues for the surface of asteroid Ryugu?	Geochemistry		King, A. J., <b>Bates, H. C.,</b> Krietsch, D., Busemann, H., Clay, P. H., Schofield, P. F., Russell, S. S. (2019) The Yamato-type (CY) carbonaceous chondrite group: Analogues for the surface of asteroid Ryugu? <i>Geochemistry</i>. 79:125531.	KingCYs	http://hellybates.github.io/files/King2019.pdf
2021-04-15	The aqueous alteration of CM chondrites, a review	Geochimica et Cosmochimica Acta		Suttle, M. D., King, A. J., Schofield, P. F., <b>Bates, H. C.,</b> Russell, S. S. (2021) The aqueous alteration of CM chondrites, a review <i>Geochimica et Cosmochimica Acta</i> 299:219-256.	SuttleCM	http://hellybates.github.io/files/Suttle2021.pdf
2022-11-16	The Winchcombe meteorite, a unique and pristine witness from the outer solar system	Science Advances		King., A. J., Daly, L., Rowe., R., Joy, K. H., Greenwood, R. C., Devillepoix, H. A. R., Suttle, M. D., Chan, Q. S., Russell, S. S., <b>Bates, H. C.,</b> et al. (2022) The Winchcombe meteorite, a unique and pristine witness from the outer solar system <i>Science Advances</i> 8:eabq3925.	KingWinchcombe	http://hellybates.github.io/files/King2022.pdf